{
	"title": "Rise of the Tomb Raider",
	"brief": {
		"type": "aaa",
		"role": "Systems Programmer",
		"description": "Implement keyboard and mouse controls on PC and integrated Razer Chroma features",
		"released": "2016-01-26",
		"employer": "nixxes",
		"platforms": [ "windows", "steam", "uwp" ],
		"technologies": [ "c++", "as", "scaleform", "cdc" ]
	},
	"trailer": {
		"link": "yt://PhGEFLcPHsY",
		"image": "rise-of-the-tomb-raider.jpg"
	},
	"source": "rise-of-the-tomb-raider.md"
}