{
	"title": "Far Cry 6",
	"brief": {
		"description": "As a Lead UI Programmer, I implemented features using a properietary UI framework and mentored several direct reports to help them achieve their OKRs.",
		"released": "2021-10-06",
		"employer": "ubisoft",
		"platforms": [ "uplay", "windows", "xbone", "xbonex", "ps4", "ps5" ],
		"technologies": [ "c++" ],
		"role": "UI Programmer",
		"type": "aaa",
		"stack": [ "Dunia" ]
	},
	"trailer": {
		"link": "yt://-IJuKT1mHO8",
		"image": "far-cry-6.jpg"
	},
	"source": "far-cry-6.md"
}