{
	"title": "Procedural Design",
	"brief": {
		"type": "school",
		"role": "Student",
		"description": "School assignment about procedurally generated content.",
		"released": "2012-08-01",
		"employer": "igad",
		"platforms": [ "windows" ],
		"technologies": [ "c++", "opengl2" ]
	},
	"trailer": {
		"link": "",
		"image": "procedural.jpg"
	},
	"source": "procedural.md"
}