{
	"title": "Lara Croft and the Temple of Osiris",
	"brief": {
		"type": "aaa",
		"role": "Systems Programmer",
		"description": "As a Systems Programmer, I ensured the Steam version worked well with mouse and keyboard and designed the front-end for the text chat feature.",
		"released": "2014-12-01",
		"employer": "nixxes",
		"platforms": [ "steam", "windows", "ps4" ],
		"technologies": [ "cdc", "scaleform", "c++", "as" ]
	},
	"trailer": {
		"link": "yt://a4iiWCaI32g",
		"image": "lara-croft-and-the-temple-of-osiris.jpg"
	},
	"source": "lara-croft-and-the-temple-of-osiris.md"
}