{
	"title": "Skull & Bones",
	"brief": {
		"type": "aaa",
		"role": "Lead UI Programmer",
		"description": "Implemented online features, managed production priorities on the UI team, and mentored several direct reports",
		"released": "2024-02-13",
		"employer": "ubisoft",
		"platforms": [ "windows", "steam" ],
		"technologies": ["c++", "phoenix"]
	},
	"trailer": {
		"link": "yt://OmDYo7MbQxo",
		"image": "skull-and-bones.jpg"
	},
	"source": "skull-and-bones.md"
}