{
	"title": "Game of Thrones: Seven Kingdoms",
	"brief": {
		"type": "f2p",
		"role": "Senior UI Programmer",
		"description": "Built custom UI features for this free-to-play title using Amazon's Lumberyard engine",
		"released": "2018-01-01",
		"employer": "bigpoint",
		"platforms": [ "windows" ],
		"technologies": [ "c++", "ly" ]
	},
	"trailer": {
		"image": "got.jpg"
	},
	"source": "game-of-thrones-seven-kingdoms.md"
}