{
	"title": "Thief",
	"brief": {
		"type": "aaa",
		"role": "Systems Programmer",
		"description": "Implemented keyboard and mouse support and map navigation on PC",
		"released": "2014-02-01",
		"employer": "nixxes",
		"platforms": [ "steam" ],
		"technologies": [ "c++", "as", "scaleform", "ue3" ]
	},
	"trailer": {
		"link": "yt://6FtOFv5oGEI",
		"image": "thief.jpg"
	},
	"source": "thief.md"
}