{
	"title": "Dolphin Dreams",
	"brief": {
		"type": "school",
		"role": "Intern",
		"description": "Optimized and implemented new features on a serious game project for children with severe mental disabilities",
		"released": "2012-09-01",
		"employer": "digc",
		"platforms": [ "windows" ],
		"technologies": [ "c++", "horde3d", "opengl2" ]
	},
	"trailer": {
		"image": "dolphin-dreams.jpg"
	},
	"source": "dolphin-dreams.md"
}