{
	"title": "Relativity",
	"brief": {
		"type": "school",
		"description": "Networked real-time strategy game in which multiple factions fight over control of time itself.",
		"released": "2010-08-01",
		"employer": "igad",
		"role": "Team Lead",
		"platforms": [ "windows" ],
		"technologies": [ "c++", "opengl2", "qt" ]
	},
	"trailer": {
		"link": "yt://64vjOvDIamg",
		"image": "relativity.jpg"
	},
	"source": "relativity.md"
}