{
	"title": "FlinQ 4.0",
	"brief": {
		"type": "software",
		"role": "Junior Developer",
		"description": "Security management package that combines reports from multiple sources into a single and intuitive 3D interface.",
		"released": "2013-09-01",
		"employer": "flexposure",
		"platforms": [ "windows", "mac" ],
		"technologies": [ "c++", "csharp", "opengl3" ]
	},
	"trailer": {
		"link": "yt://IjLIkTY32VM",
		"image": "flinq4.jpg"
	},
	"source": "flinq4.md"
}