{
	"title": "Deus Ex: Mankind Divided",
	"brief": {
		"type": "aaa",
		"role": "Systems Programmer",
		"description": "As a Systems Programmer, I implemented several key features for the Steam version, including the weapons bar and the key rebinding screen.",
		"released": "2016-08-23",
		"employer": "nixxes",
		"platforms": [ "steam", "windows" ],
		"technologies": [ "g2", "scaleform", "c++", "as" ],
		"stack": [ "Dawn Engine", "Autodesk Scaleform", "ActionScript 3" ]
	},
	"trailer": {
		"link": "yt://CfV01sTqB68",
		"image": "deus-ex-mankind-divided.jpg"
	},
	"source": "deus-ex-mankind-divided.md"
}