{
	"title": "FlinQ 4.0",
	"brief": {
		"type": "software",
		"role": "Junior Developer",
		"description": "Implemented UI features and device drivers for a 3D security management package",
		"released": "2013-09-01",
		"employer": "flexposure",
		"platforms": [ "windows", "mac" ],
		"technologies": [ "c++", "csharp", "opengl3" ]
	},
	"trailer": {
		"link": "yt://IjLIkTY32VM",
		"image": "flinq4.jpg"
	},
	"source": "flinq4.md"
}