{
	"title": "Far Cry 6",
	"brief": {
		"description": "Implemented features using a proprietary UI framework and managed several direct reports",
		"released": "2021-10-06",
		"employer": "ubisoft",
		"platforms": [ "uplay", "windows", "xbone", "xbonex", "ps4", "ps5" ],
		"technologies": [ "c++" ],
		"role": "UI Programmer",
		"type": "aaa",
		"stack": [ "Dunia" ]
	},
	"trailer": {
		"link": "yt://-IJuKT1mHO8",
		"image": "far-cry-6.jpg"
	},
	"source": "far-cry-6.md"
}